Enter password: ****
Welcome to the MySQL monitor.  Commands end with ; or \g.
Your MySQL connection id is 8
Server version: 8.0.19 MySQL Community Server - GPL

Copyright (c) 2000, 2020, Oracle and/or its affiliates. All rights reserved.

Oracle is a registered trademark of Oracle Corporation and/or its
affiliates. Other names may be trademarks of their respective
owners.

Type 'help;' or '\h' for help. Type '\c' to clear the current input statement.

mysql> show databases;
+--------------------+
| Database           |
+--------------------+
| information_schema |
| mysql              |
| performance_schema |
| sys                |
+--------------------+
4 rows in set (0.02 sec)

mysql> create database BidvestBank;
Query OK, 1 row affected (0.01 sec)

mysql> show databases;
+--------------------+
| Database           |
+--------------------+
| bidvestbank        |
| information_schema |
| mysql              |
| performance_schema |
| sys                |
+--------------------+
5 rows in set (0.00 sec)

mysql> create table BankBranch(branch_name varchar(20),
    -> branch_city varchar(20),
    -> assets int;
ERROR 1064 (42000): You have an error in your SQL syntax; check the manual that corresponds to your MySQL server version for the right syntax to use near '' at line 3
mysql> create table BankBranch(branch_name varchar(20),
    -> branch_city varchar(20),
    -> assets int);
ERROR 1046 (3D000): No database selected
mysql> use bidvestbank;
Database changed
mysql> create table BankBranch(branch_name varchar(20),
    -> branch_city varchar(20),
    -> assets int);
Query OK, 0 rows affected (0.11 sec)

mysql> create table Customer( customer_name varchar(20),
    -> customer_street varchar(20),
    -> customer_city varchar(20));
Query OK, 0 rows affected (0.04 sec)

mysql> create table CustomerAccount(account number(20),
    -> branch_name varchar(20),
    -> branch_name varchar(20),
    -> ;
ERROR 1064 (42000): You have an error in your SQL syntax; check the manual that corresponds to your MySQL server version for the right syntax to use near 'number(20),
branch_name varchar(20),
branch_name varchar(20),' at line 1
mysql> create table CustomerAccount(account_number int,
    -> branch_name varchar(10),
    -> balance double);
Query OK, 0 rows affected (0.05 sec)

mysql> delete from CustomerAccount;
Query OK, 0 rows affected (0.01 sec)

mysql> create table CustomerAccount(account_number char(10),
    -> branch_name varchar(20),
    -> balance double);
ERROR 1050 (42S01): Table 'customeraccount' already exists
mysql> drop table CustomerAccount;
Query OK, 0 rows affected (0.03 sec)

mysql> create table CustomerAccount(account_number char(10),
    -> branch_name varchar(20),
    -> balance double);
Query OK, 0 rows affected (0.04 sec)

mysql> create table loan(loan_number var(10), branch_name varchar(20), amount double);
ERROR 1064 (42000): You have an error in your SQL syntax; check the manual that corresponds to your MySQL server version for the right syntax to use near 'var(10), branch_name varchar(20), amount double)' at line 1
mysql> create table loan(loan_number char(10), branch_name varchar(20), amount double);
Query OK, 0 rows affected (0.04 sec)

mysql> create table depositor(customer_name  varchar(20), accountNumber int);
Query OK, 0 rows affected (0.04 sec)

mysql> create table borrower(customer_name varchar(20), loan_number char(10));
Query OK, 0 rows affected (0.04 sec)

mysql> create table employee(employee_name varchar(20), branch_name varchar(10), salary double);
Query OK, 0 rows affected (0.04 sec)

mysql> show tables;
+-----------------------+
| Tables_in_bidvestbank |
+-----------------------+
| bankbranch            |
| borrower              |
| customer              |
| customeraccount       |
| depositor             |
| employee              |
| loan                  |
+-----------------------+
7 rows in set (0.01 sec)

mysql> alter table BankBranch
    -> add Primary Key(branch_name);
Query OK, 0 rows affected (0.10 sec)
Records: 0  Duplicates: 0  Warnings: 0

mysql> alter table Customer
    -> add Primary Key(customer_name);
Query OK, 0 rows affected (0.08 sec)
Records: 0  Duplicates: 0  Warnings: 0

mysql> alter table CustomerAccount
    -> add Primary Key(account_number);
Query OK, 0 rows affected (0.08 sec)
Records: 0  Duplicates: 0  Warnings: 0

mysql> alter table Depositor
    -> add Primary Key(account_number);
ERROR 1072 (42000): Key column 'account_number' doesn't exist in table
mysql> alter table Depositor
    -> add Primary Key(account_number);
ERROR 1072 (42000): Key column 'account_number' doesn't exist in table
mysql> alter table depositor
    -> add constraint fk_account_number
    -> foreign key (account_number)
    -> References CustomerAccount(account_number);
ERROR 1072 (42000): Key column 'account_number' doesn't exist in table
mysql> alter table depositor
    -> add primary key(accountNumber);
Query OK, 0 rows affected (0.07 sec)
Records: 0  Duplicates: 0  Warnings: 0

mysql> alter table loan
    -> add primary key(loan_number););
Query OK, 0 rows affected (0.09 sec)
Records: 0  Duplicates: 0  Warnings: 0

ERROR 1064 (42000): You have an error in your SQL syntax; check the manual that corresponds to your MySQL server version for the right syntax to use near ')' at line 1
mysql> alter table borrower
    -> add primary key(loan_number);
Query OK, 0 rows affected (0.07 sec)
Records: 0  Duplicates: 0  Warnings: 0

mysql> alter table employee
    -> add primary key(employee_name);
Query OK, 0 rows affected (0.07 sec)
Records: 0  Duplicates: 0  Warnings: 0

mysql> insert into CustomerAccount values ('A-5324','Newtown',500);
Query OK, 1 row affected (0.01 sec)

mysql> insert into CustomerAccount values ('A-5624','Sunnyside',400);
Query OK, 1 row affected (0.01 sec)

mysql> insert into CustomerAccount values ('A-7794','Midrand',900);
Query OK, 1 row affected (0.01 sec)

mysql> insert into CustomerAccount values ('A-4467','Mabopane',700);
Query OK, 1 row affected (0.01 sec)

mysql> insert into CustomerAccount values ('A-3546','Midrand',7500);
Query OK, 1 row affected (0.01 sec)

mysql> insert into CustomerAccount values ('A-3453',Úniversitas',700);
    '> ;
    '> insert into CustomerAccount values ('A-3453','Universitas', 700);
    '> ::
    '> ;;
    '> );
    '>
    '> insert into CustomerAccount values ('A-3453','Universitas',700);
    '> exit
    '> exit;
    '> q;
    '> chbvbgbgfb
    '> '
    -> '';
ERROR 1064 (42000): You have an error in your SQL syntax; check the manual that corresponds to your MySQL server version for the right syntax to use near '',700);
;
insert into CustomerAccount values ('A-3453','Universitas', 700);
::
;' at line 1
mysql> insert into CustomerAccount values ('A-3453','Universitas',700);
Query OK, 1 row affected (0.01 sec)

mysql> insert into CustomerAccount values ('A-2542','Mamelodi',350);
Query OK, 1 row affected (0.01 sec)

mysql> delete from CustomerAccount where account_number = 'A-3546';
Query OK, 1 row affected (0.01 sec)

mysql> insert into CustomerAccount values ('A-3546','Midrand',750);
Query OK, 1 row affected (0.01 sec)

mysql> insert into BankBranch values('Midrand','Johannesburg',7100000);
Query OK, 1 row affected (0.01 sec)

mysql> insert into BankBranch values('Newtown','Johannesburg',9000000);
Query OK, 1 row affected (0.01 sec)

mysql> insert into BankBranch values('Mabopane','Pretoria',400000);
Query OK, 1 row affected (0.01 sec)

mysql> insert into BankBranch values('Belgravia','Kimberly',3700000);
Query OK, 1 row affected (0.01 sec)

mysql> insert into BankBranch values('Sunnyside','Pretoria',1700000);
Query OK, 1 row affected (0.01 sec)

mysql> insert into BankBranch values('Amanzimtoti','Durban',300000);
Query OK, 1 row affected (0.01 sec)

mysql> insert into BankBranch values('Universitas','Bloemfontein',2100000);
Query OK, 1 row affected (0.01 sec)

mysql> insert into BankBranch values('Mamelodi','Pretoria',8000000);
Query OK, 1 row affected (0.01 sec)

mysql> insert into Customer values('Modise','Spring','George')
    -> ;
Query OK, 1 row affected (0.01 sec)

mysql> insert into Customer values('Brooks','Senator','Johannesburg');
Query OK, 1 row affected (0.01 sec)

mysql> insert into Customer values('Jooste','North','Kimberly');
Query OK, 1 row affected (0.01 sec)

mysql> insert into Customer values('Lombard','Sand Hill','Port-Elizabeth');
Query OK, 1 row affected (0.01 sec)

mysql> insert into Customer values('Mokwena','Walnut','Port-Elizabeth');
Query OK, 1 row affected (0.01 sec)

mysql> insert into Customer values('Johnson','Mmabatho','Mafikeng');
Query OK, 1 row affected (0.01 sec)

mysql> insert into Customer values('Johnson','Alma','Bloemfontein');
ERROR 1062 (23000): Duplicate entry 'Johnson' for key 'customer.PRIMARY'
mysql> show tabels;
ERROR 1064 (42000): You have an error in your SQL syntax; check the manual that corresponds to your MySQL server version for the right syntax to use near 'tabels' at line 1
mysql> show tables;
+-----------------------+
| Tables_in_bidvestbank |
+-----------------------+
| bankbranch            |
| borrower              |
| customer              |
| customeraccount       |
| depositor             |
| employee              |
| loan                  |
+-----------------------+
7 rows in set (0.01 sec)

mysql> drop table customer;
Query OK, 0 rows affected (0.06 sec)

mysql> show tables;
+-----------------------+
| Tables_in_bidvestbank |
+-----------------------+
| bankbranch            |
| borrower              |
| customeraccount       |
| depositor             |
| employee              |
| loan                  |
+-----------------------+
6 rows in set (0.00 sec)

mysql> create table customer(customer_name varchar(25) not null auto_increment primary key,
    -> customer_street varchar(25), customer_city varchar(25));
ERROR 1063 (42000): Incorrect column specifier for column 'customer_name'
mysql> create table customer(customer_name varchar(25) not null auto_increment,
    -> customer_street varchar(25), customer_city varchar(25));
ERROR 1063 (42000): Incorrect column specifier for column 'customer_name'
mysql> create table customer(customer_name varchar(25) not null unsigned auto_increment,
    -> customer_street varchar(25), customer_city varchar(25));
ERROR 1064 (42000): You have an error in your SQL syntax; check the manual that corresponds to your MySQL server version for the right syntax to use near 'unsigned auto_increment,
customer_street varchar(25), customer_city varchar(25))' at line 1
mysql> create table customer(customer_name varchar(25) not null,
    -> customer_street varchar(25), customer_city varchar(25));
Query OK, 0 rows affected (0.04 sec)

mysql> insert into Customer values('Modise','Spring','George');
Query OK, 1 row affected (0.01 sec)

mysql> insert into Customer values('Brooks','Senator','Johannesburg');
Query OK, 1 row affected (0.01 sec)

mysql> insert into Customer values('Jooste','North','Kimberly');
Query OK, 1 row affected (0.01 sec)

mysql> insert into Customer values('Lombard','Sand Hill','Nelspruit);'
    -> ;
ERROR 1064 (42000): You have an error in your SQL syntax; check the manual that corresponds to your MySQL server version for the right syntax to use near '' at line 1
mysql> '';
ERROR 1064 (42000): You have an error in your SQL syntax; check the manual that corresponds to your MySQL server version for the right syntax to use near '''' at line 1
mysql> insert into Customer values('Lombard','Sand Hill','Nelspruit);
    '> insert into Customer values('Lombard','Sand Hill','Nelspruit);
ERROR 1064 (42000): You have an error in your SQL syntax; check the manual that corresponds to your MySQL server version for the right syntax to use near 'Lombard','Sand Hill','Nelspruit)' at line 2
mysql> insert into Customer values('Lombard','Sand Hill','Nelspruit');
Query OK, 1 row affected (0.01 sec)

mysql> insert into Customer values('Mokwena','Walnut','Port-Elizabeth');
Query OK, 1 row affected (0.00 sec)

mysql> insert into Customer values('Johnson','Mmabatho','Port-Elizabeth');
Query OK, 1 row affected (0.01 sec)

mysql> insert into Customer values('Johnson','Alma','Bloemfontein');
Query OK, 1 row affected (0.01 sec)

mysql> insert into Customer values('Zwane','Main','Mafikeng');
Query OK, 1 row affected (0.01 sec)

mysql> insert into Customer values('Lindsay','Park','George');
Query OK, 1 row affected (0.01 sec)

mysql> insert into Customer values('Smith','North','Kimberly');
Query OK, 1 row affected (0.01 sec)

mysql> insert into Customer values('Dlamini','Putnam','Port-Elizabeth');
Query OK, 1 row affected (0.01 sec)

mysql> insert into Customer values('Williams','Nassau','Giyane');
Query OK, 1 row affected (0.00 sec)

mysql> insert into Depositor values('Johnson','A-5624');
ERROR 1366 (HY000): Incorrect integer value: 'A-5624' for column 'accountNumber' at row 1
mysql> drop table depositor;
Query OK, 0 rows affected (0.06 sec)

mysql> show tables;
+-----------------------+
| Tables_in_bidvestbank |
+-----------------------+
| bankbranch            |
| borrower              |
| customer              |
| customeraccount       |
| employee              |
| loan                  |
+-----------------------+
6 rows in set (0.01 sec)

mysql> create table Depositor(customer_name varchar(20), accountNumber char(10));
Query OK, 0 rows affected (0.04 sec)

mysql> alter table Depositor
    -> add primary key(accountNumber);
Query OK, 0 rows affected (0.10 sec)
Records: 0  Duplicates: 0  Warnings: 0

mysql> insert into Depositor values('Johnson','A-5624');
Query OK, 1 row affected (0.01 sec)

mysql> insert into Depositor values('Johnson','A-5624');
ERROR 1062 (23000): Duplicate entry 'A-5624' for key 'depositor.PRIMARY'
mysql> drop table depositor;
Query OK, 0 rows affected (0.03 sec)

mysql> create table Depositor(customer_name varchar(20), accountNumber char(10));
Query OK, 0 rows affected (0.04 sec)

mysql> alter table Depositor
    -> add primary key(accountNumber);
Query OK, 0 rows affected (0.07 sec)
Records: 0  Duplicates: 0  Warnings: 0

mysql> insert into Depositor values('Johnson','A-5624');
Query OK, 1 row affected (0.00 sec)

mysql> insert into Depositor values('Johnson','A-5624');
ERROR 1062 (23000): Duplicate entry 'A-5624' for key 'depositor.PRIMARY'
mysql> drop table depositor;
Query OK, 0 rows affected (0.03 sec)

mysql> create table Depositor(customer_name varchar(20), accountNumber char(10));
Query OK, 0 rows affected (0.05 sec)

mysql> insert into Depositor values('Johnson','A-5624');
Query OK, 1 row affected (0.01 sec)

mysql> insert into Depositor values('Johnson','A-5624');
Query OK, 1 row affected (0.01 sec)

mysql> insert into Depositor values('Johnson','A-7794');
Query OK, 1 row affected (0.01 sec)

mysql> insert into Depositor values('Zwane','A-3546');
Query OK, 1 row affected (0.01 sec)

mysql> insert into Depositor values('Lindsay','A-3453');
Query OK, 1 row affected (0.01 sec)

mysql> insert into Depositor values('Smith','A-4467');
Query OK, 1 row affected (0.01 sec)

mysql> insert into Depositor values('Dlamini','A-2542');
Query OK, 1 row affected (0.01 sec)

mysql> insert into loan values('L-14','Mamelodi',900);
Query OK, 1 row affected (0.01 sec)

mysql> delete from loan where 'amount' = 900;
ERROR 1292 (22007): Truncated incorrect DOUBLE value: 'amount'
mysql> delete from loan where 'amount' = 900.00;
ERROR 1292 (22007): Truncated incorrect DOUBLE value: 'amount'
mysql> delete from loan where 'loan_number'= L-14;
ERROR 1054 (42S22): Unknown column 'L' in 'where clause'
mysql> insert into loan values('L-11','Newtown', 1500);
Query OK, 1 row affected (0.00 sec)

mysql> insert into loan values('L-15','Sunnyside',1500);
Query OK, 1 row affected (0.01 sec)

mysql> insert into loan values('L-16','Sunnyside',1300);
Query OK, 1 row affected (0.01 sec)

mysql> insert into loan values('L-17','Newtown',1000);
Query OK, 1 row affected (0.01 sec)

mysql> insert into loan values('L-23','Universitas',2000);
Query OK, 1 row affected (0.01 sec)

mysql> insert into loan values('L-93','Mabopane',500);
Query OK, 1 row affected (0.01 sec)

mysql> insert into borrower values('Modise','L-16');
Query OK, 1 row affected (0.01 sec)

mysql> insert into borrower values('Jooste','L-93');
Query OK, 1 row affected (0.01 sec)

mysql> insert into borrower values('Johnson','L-15');
Query OK, 1 row affected (0.01 sec)

mysql> insert into borrower values('Jackson','L-14');
Query OK, 1 row affected (0.01 sec)

mysql> insert into borrower values('Smith','L-11');
Query OK, 1 row affected (0.01 sec)

mysql> insert into borrower values('Smith','L-23');
Query OK, 1 row affected (0.01 sec)

mysql> insert into borrower values('Williams','L-17');
Query OK, 1 row affected (0.01 sec)

mysql> insert into employee values('Modise','Sunnyside',1500);
Query OK, 1 row affected (0.01 sec)

mysql> insert into employee values('Brown','Sunnyside',1300);
Query OK, 1 row affected (0.01 sec)

mysql> insert into employee values('Gopal','Sunnyside',5300);
Query OK, 1 row affected (0.01 sec)

mysql> insert into employee values('Johnson','Newtown',1500);
Query OK, 1 row affected (0.01 sec)

mysql> insert into employee values('Loreena','Newtown',1300);
Query OK, 1 row affected (0.01 sec)

mysql> insert into employee values('Peterson','Newtown',2500);
Query OK, 1 row affected (0.01 sec)

mysql> insert into employee values('Rao','Austin',1500);
Query OK, 1 row affected (0.01 sec)

mysql> insert into employee values('Sato','Austin',1600);
Query OK, 1 row affected (0.00 sec)

mysql> select * from CustomerAccount where balance < 700;
+----------------+-------------+---------+
| account_number | branch_name | balance |
+----------------+-------------+---------+
| A-2542         | Mamelodi    |     350 |
| A-5324         | Newtown     |     500 |
| A-5624         | Sunnyside   |     400 |
+----------------+-------------+---------+
3 rows in set (0.00 sec)

mysql> select customer_name from customer where customer_city = 'Johannesburg';
+---------------+
| customer_name |
+---------------+
| Brooks        |
+---------------+
1 row in set (0.00 sec)

mysql> select * from employees where salary > 1500 and not branch_name = 'Newtown';
ERROR 1146 (42S02): Table 'bidvestbank.employees' doesn't exist
mysql> select * from employee where salary > 1500 and not branch_name = 'Newtown';
+---------------+-------------+--------+
| employee_name | branch_name | salary |
+---------------+-------------+--------+
| Gopal         | Sunnyside   |   5300 |
| Sato          | Austin      |   1600 |
+---------------+-------------+--------+
2 rows in set (0.00 sec)

mysql> select AVG(salary) as avg_salary
    -> from employee;
+------------+
| avg_salary |
+------------+
|     2062.5 |
+------------+
1 row in set (0.00 sec)

mysql> select MAX(assets) as LargestNumberOfAssets
    -> from bankbranch;
+-----------------------+
| LargestNumberOfAssets |
+-----------------------+
|               9000000 |
+-----------------------+
1 row in set (0.00 sec)

mysql> select employee_name from employee where branch_name = 'Sunnyside';
+---------------+
| employee_name |
+---------------+
| Brown         |
| Gopal         |
| Modise        |
+---------------+
3 rows in set (0.00 sec)

mysql> select * from borrower;
+---------------+-------------+
| customer_name | loan_number |
+---------------+-------------+
| Smith         | L-11        |
| Jackson       | L-14        |
| Johnson       | L-15        |
| Modise        | L-16        |
| Williams      | L-17        |
| Smith         | L-23        |
| Jooste        | L-93        |
+---------------+-------------+
7 rows in set (0.00 sec)

mysql> select accountNumber from customeraccount where balance > 900;
ERROR 1054 (42S22): Unknown column 'accountNumber' in 'field list'
mysql> select account_number from customeraccount where balance > 900;
Empty set (0.00 sec)

mysql> select account_number, balance from customeraccount where branch_name = 'Newtown';
+----------------+---------+
| account_number | balance |
+----------------+---------+
| A-5324         |     500 |
+----------------+---------+
1 row in set (0.00 sec)

mysql> select account_number, balance from customeraccount where branch_name = 'Newtown' and balance >600;
Empty set (0.00 sec)

mysql> select branch_name, assets from bankbranch;
+-------------+---------+
| branch_name | assets  |
+-------------+---------+
| Amanzimtoti |  300000 |
| Belgravia   | 3700000 |
| Mabopane    |  400000 |
| Mamelodi    | 8000000 |
| Midrand     | 7100000 |
| Newtown     | 9000000 |
| Sunnyside   | 1700000 |
| Universitas | 2100000 |
+-------------+---------+
8 rows in set (0.00 sec)

mysql>